{"schema_version":"1.0.0-fixture","fixture":true,"operational":false,"readiness_percent":15,"cutover_status":"LOCKED","safeguards":[{"name":"Preserve V1 production paths","status":"ACTIVE","detail":"Current admin, map, calendar and feeds remain untouched."},{"name":"Preserve IDs and curated records","status":"PLANNED","detail":"V2 migration must retain stable identity and NYCIF editorial precedence."},{"name":"Shadow comparison","status":"PLANNED","detail":"V2 must compare against V1 before production authority changes."},{"name":"Immediate rollback","status":"LOCKED","detail":"Cutover requires a retained V1 rollback path and explicit approval."}]}